{
  "$ref": "#/definitions/sermons",
  "definitions": {
    "sermons": {
      "type": "object",
      "properties": {
        "title": {
          "type": "string"
        },
        "speaker": {
          "type": "string"
        },
        "date": {
          "type": "string"
        },
        "category": {
          "type": "string"
        },
        "duration": {
          "type": "string"
        },
        "verse": {
          "type": "string"
        },
        "excerpt": {
          "type": "string"
        },
        "youtubeUrl": {
          "type": "string"
        },
        "$schema": {
          "type": "string"
        }
      },
      "required": [
        "title",
        "speaker",
        "date",
        "category",
        "duration",
        "verse",
        "excerpt"
      ],
      "additionalProperties": false
    }
  },
  "$schema": "http://json-schema.org/draft-07/schema#"
}