{
  "title": "Restoring the Foundation of Marriage",
  "speaker": "Peter Milimo",
  "date": "May 2025",
  "category": "Marriage Restoration",
  "duration": "52 min",
  "verse": "\"What God has joined together, let no one separate.\" — Mark 10:9",
  "excerpt": "Marriage was designed by God to reflect His love. Peter Milimo unpacks the biblical keys to healing, reconciliation, and building a covenant home that thrives.",
  "youtubeUrl": ""
}
