{
  "title": "Awakening a Generation to Purpose",
  "speaker": "Peter Milimo",
  "date": "March 2025",
  "category": "Youth Empowerment",
  "duration": "48 min",
  "verse": "\"Do not let anyone look down on you because you are young.\" — 1 Timothy 4:12",
  "excerpt": "Young people are not the church of tomorrow — they are the church of today. Peter Milimo calls this generation to rise and walk boldly in their God-given calling.",
  "youtubeUrl": ""
}
