{
  "title": "Leading with Integrity: The Servant Leader",
  "speaker": "Peter Milimo",
  "date": "April 2025",
  "category": "Christian Leadership",
  "duration": "44 min",
  "verse": "\"Whoever wants to be great among you must be your servant.\" — Matthew 20:26",
  "excerpt": "True leadership flows from humility and biblical wisdom. This teaching challenges and equips leaders in the church, family, and marketplace.",
  "youtubeUrl": ""
}
